{
  "catalogId": "flux/components@1",
  "version": "1.0.0",
  "extends": [
    "a2ui/basic@0.10"
  ],
  "tokens": {
    "light": "./tokens/flux-light.json",
    "dark": "./tokens/flux-dark.json"
  },
  "components": {
    "FluxBadge": {
      "name": "FluxBadge",
      "extends": "Text",
      "category": "primitive",
      "jsonSchema": {
        "type": "object",
        "properties": {
          "component": {
            "type": "string",
            "const": "FluxBadge"
          },
          "id": {
            "type": "string"
          },
          "label": {
            "type": "string"
          },
          "tone": {
            "default": "neutral",
            "type": "string",
            "enum": [
              "neutral",
              "primary",
              "success",
              "warning",
              "danger"
            ]
          },
          "variant": {
            "default": "subtle",
            "type": "string",
            "enum": [
              "subtle",
              "solid"
            ]
          },
          "size": {
            "default": "sm",
            "type": "string",
            "enum": [
              "xs",
              "sm",
              "md"
            ]
          },
          "accessibility": {
            "type": "object",
            "properties": {
              "label": {
                "type": "string"
              },
              "description": {
                "type": "string"
              }
            },
            "required": [
              "label"
            ],
            "additionalProperties": false
          }
        },
        "required": [
          "component",
          "id",
          "label",
          "tone",
          "variant",
          "size"
        ],
        "additionalProperties": false
      },
      "tokens": [
        "color.bg.subtle",
        "color.primary.subtle",
        "color.primary.solid",
        "color.success.subtle",
        "color.success.solid",
        "color.warning.3",
        "color.warning.9",
        "color.danger.subtle",
        "color.danger.solid",
        "color.text.primary",
        "color.text.muted",
        "color.text.onBrand",
        "space.0_5",
        "space.1",
        "space.1_5",
        "space.2",
        "radius.sm",
        "radius.full",
        "typography.size.xs",
        "typography.size.sm",
        "typography.weight.medium"
      ],
      "variants": {
        "tone": {
          "neutral": {
            "backgroundColor": "$color.bg.subtle",
            "color": "$color.text.muted"
          },
          "primary": {
            "backgroundColor": "$color.primary.subtle",
            "color": "$color.text.primary"
          },
          "success": {
            "backgroundColor": "$color.success.subtle",
            "color": "$color.success.solid"
          },
          "warning": {
            "backgroundColor": "$color.warning.3",
            "color": "$color.warning.9"
          },
          "danger": {
            "backgroundColor": "$color.danger.subtle",
            "color": "$color.danger.solid"
          }
        },
        "variant": {
          "subtle": {
            "borderRadius": "$radius.sm",
            "fontWeight": "$typography.weight.medium"
          },
          "solid": {
            "borderRadius": "$radius.full",
            "fontWeight": "$typography.weight.medium"
          }
        },
        "size": {
          "xs": {
            "paddingBlock": "$space.0_5",
            "paddingInline": "$space.1",
            "fontSize": "$typography.size.xs"
          },
          "sm": {
            "paddingBlock": "$space.0_5",
            "paddingInline": "$space.1_5",
            "fontSize": "$typography.size.xs"
          },
          "md": {
            "paddingBlock": "$space.1",
            "paddingInline": "$space.2",
            "fontSize": "$typography.size.sm"
          }
        }
      },
      "compoundVariants": [
        {
          "tone": "primary",
          "variant": "solid",
          "style": {
            "backgroundColor": "$color.primary.solid",
            "color": "$color.text.onBrand"
          }
        },
        {
          "tone": "success",
          "variant": "solid",
          "style": {
            "backgroundColor": "$color.success.solid",
            "color": "$color.text.onBrand"
          }
        },
        {
          "tone": "danger",
          "variant": "solid",
          "style": {
            "backgroundColor": "$color.danger.solid",
            "color": "$color.text.onBrand"
          }
        }
      ],
      "defaultVariants": {
        "tone": "neutral",
        "variant": "subtle",
        "size": "sm"
      },
      "accessibility": {
        "label": "optional",
        "role": "status"
      },
      "llm": {
        "description": "Compact label for status, counts, or tags. Not clickable — if the affordance needs to trigger an action, use a small button instead. Tones align with the rest of the catalog (neutral/primary/success/warning/danger).",
        "tags": [
          "label",
          "status",
          "count",
          "tag"
        ],
        "examples": [
          {
            "code": "UI.badge(\"New\", tone=\"primary\", variant=\"solid\")",
            "caption": "Solid primary tag for highlighted items."
          },
          {
            "code": "UI.badge(\"Live\", tone=\"success\", size=\"md\")",
            "caption": "Subtle success label in the larger size."
          }
        ],
        "antiPatterns": [
          {
            "code": "UI.badge(\"Click me\", action=\"open\")",
            "reason": "Badges are not interactive. Use UI.button with size=sm for a clickable chip."
          },
          {
            "code": "UI.badge(\"Download the Q3 2024 revenue and expenses report here\", tone=\"primary\")",
            "reason": "Badge copy must be short (ideally ≤3 words). Long copy belongs in Text, not a badge."
          }
        ],
        "budget": {
          "children": 0,
          "siblings": 12,
          "depth": 6
        }
      },
      "renderer": {
        "react": "./renderers/react/FluxBadge.tsx",
        "fallback": {
          "component": "Text",
          "map": {
            "label": "text"
          },
          "notes": "Basic renderers drop tone + variant + size styling; the badge collapses to a short plain-text run."
        }
      }
    },
    "FluxBanner": {
      "name": "FluxBanner",
      "extends": "Row",
      "category": "compound",
      "jsonSchema": {
        "type": "object",
        "properties": {
          "component": {
            "type": "string",
            "const": "FluxBanner"
          },
          "id": {
            "type": "string"
          },
          "title": {
            "type": "string"
          },
          "message": {
            "type": "string"
          },
          "tone": {
            "default": "info",
            "type": "string",
            "enum": [
              "info",
              "success",
              "warning",
              "danger"
            ]
          },
          "icon": {
            "type": "string"
          },
          "action": {
            "type": "string"
          },
          "dismiss": {
            "type": "string"
          },
          "accessibility": {
            "type": "object",
            "properties": {
              "label": {
                "type": "string"
              },
              "description": {
                "type": "string"
              }
            },
            "required": [
              "label"
            ],
            "additionalProperties": false
          }
        },
        "required": [
          "component",
          "id",
          "title",
          "message",
          "tone"
        ],
        "additionalProperties": false
      },
      "slots": {
        "icon": {
          "kind": "Icon",
          "required": false
        },
        "action": {
          "kind": "FluxButton",
          "required": false,
          "max": 1
        },
        "dismiss": {
          "kind": "FluxButton",
          "required": false,
          "max": 1
        }
      },
      "tokens": [
        "color.info.3",
        "color.info.11",
        "color.success.subtle",
        "color.success.solid",
        "color.warning.3",
        "color.warning.9",
        "color.danger.subtle",
        "color.danger.solid",
        "space.2",
        "space.3",
        "space.4",
        "radius.md",
        "shadow.sm"
      ],
      "variants": {
        "tone": {
          "info": {
            "backgroundColor": "$color.info.3",
            "color": "$color.info.11",
            "borderRadius": "$radius.md",
            "paddingBlock": "$space.3",
            "paddingInline": "$space.4"
          },
          "success": {
            "backgroundColor": "$color.success.subtle",
            "color": "$color.success.solid",
            "borderRadius": "$radius.md",
            "paddingBlock": "$space.3",
            "paddingInline": "$space.4"
          },
          "warning": {
            "backgroundColor": "$color.warning.3",
            "color": "$color.warning.9",
            "borderRadius": "$radius.md",
            "paddingBlock": "$space.3",
            "paddingInline": "$space.4"
          },
          "danger": {
            "backgroundColor": "$color.danger.subtle",
            "color": "$color.danger.solid",
            "borderRadius": "$radius.md",
            "paddingBlock": "$space.3",
            "paddingInline": "$space.4"
          }
        }
      },
      "compoundVariants": [
        {
          "tone": "danger",
          "style": {
            "paddingBlock": "$space.2",
            "paddingInline": "$space.3",
            "boxShadow": "$shadow.sm"
          }
        }
      ],
      "defaultVariants": {
        "tone": "info"
      },
      "accessibility": {
        "label": "optional",